{
  "$schema": "https://json-schema.org/draft/2020-12/schema",
  "$id": "https://fixoa.github.io/crackspread/schemas/crosscheck.schema.json",
  "title": "crosscheck.json",
  "description": "Whiteboard claims next to PortWatch figures and headline mentions (no estimates).",
  "type": "object",
  "required": ["schema_version", "generated_at", "as_of", "fetched_at", "stale", "source", "source_url", "claims"],
  "properties": {
    "schema_version": {"const": 1},
    "generated_at": {"$ref": "#/$defs/timestamp"},
    "as_of": {"type": "string"},
    "fetched_at": {"$ref": "#/$defs/timestamp"},
    "stale": {"type": "boolean"},
    "source": {"type": "string", "minLength": 1},
    "source_url": {"type": "string", "pattern": "^https?://\\S+$"},
    "news_items_scanned": {"type": "integer", "minimum": 0},
    "claims": {
      "type": "array",
      "items": {
        "type": "object",
        "required": ["id", "label", "target", "keywords", "whiteboard", "portwatch", "mentions"],
        "properties": {
          "id": {"type": "string", "minLength": 1},
          "label": {"type": "string", "minLength": 1},
          "target": {"type": "string"},
          "keywords": {"type": "array", "items": {"type": "string"}},
          "whiteboard": {
            "type": "object",
            "required": ["value", "unit", "source", "source_url"],
            "properties": {
              "value": {"type": ["number", "string", "null"]},
              "unit": {"type": "string"},
              "source": {"type": "string"},
              "source_url": {"type": "string"},
              "as_of": {"type": ["string", "null"]}
            }
          },
          "portwatch": {
            "anyOf": [{"type": "null"}, {
              "type": "object",
              "required": ["chokepoint", "tankers_7d", "tankers_baseline", "tankers_change_pct"],
              "properties": {
                "chokepoint": {"type": ["string", "null"]},
                "tankers_7d": {"type": ["number", "null"]},
                "tankers_baseline": {"type": ["number", "null"]},
                "tankers_change_pct": {"type": ["number", "null"]},
                "latest_date": {"type": ["string", "null"]},
                "baseline_year": {"type": ["integer", "null"]},
                "source": {"type": ["string", "null"]},
                "source_url": {"type": ["string", "null"]}
              }
            }]
          },
          "mentions": {
            "type": "array",
            "maxItems": 5,
            "items": {
              "type": "object",
              "required": ["title", "source", "link", "published", "numbers"],
              "properties": {
                "title": {"type": "string"},
                "source": {"type": "string"},
                "link": {"type": "string", "pattern": "^https?://\\S+$"},
                "published": {"type": "string"},
                "numbers": {"type": "array", "items": {"type": "string"}}
              }
            }
          }
        }
      }
    }
  },
  "additionalProperties": true,
  "$defs": {
    "timestamp": {"type": "string", "pattern": "^\\d{4}-\\d{2}-\\d{2}T\\d{2}:\\d{2}:\\d{2}Z$"}
  }
}
