{
 "as_of": "2026-10-14T20:32:42Z",
 "claims": [
  {
   "id": "hormuz_flow",
   "keywords": [
    "hormuz"
   ],
   "label": "Strait of Hormuz flow",
   "mentions": [
    {
     "link": "https://news.google.com/rss/articles/CBMinwFBVV95cUxPNVg0eWh4OTZ1NG5IR1M1ZWJJejUxUncyYVVWeHB3QTdHaHYzUnRDOHBpaFpEZldsb0RNZG5SNVZDMWJIVUV6U0JZRVhLSmdtWEZfSnpGSDlXWVU1UlRRSF9wT0JSbktPRTRWT2dkazNCSmJoWDBaUl9wZEI3bjVpLUNZS2ZDWW9IQk9oUndRNU1qYUpHclhnUzhVYVU1RE0?oc=5",
     "numbers": [],
     "published": "2026-10-14T20:30:55Z",
     "source": "The Washington Post",
     "title": "Iranian attack sinks container ship in Strait of Hormuz"
    },
    {
     "link": "https://news.google.com/rss/articles/CBMi_wFBVV95cUxObHdLaEZYS08tcXlDZ0ZDYm9wd2ZMamdHUlJ4NklTaDV4M3BmOWRjbzRxaFYzTnhJTVdRaERKekRjYXM0bmRYTXFZNU1HTUFsUi1qeFNoNlVjOGJpRXVYQnd0MVBXdTJHVXV3LWdqR1NNSW4zeFJVdHFnWXU3WS1OdUhpNTdWRm9lTGhjd1d3QjhqN21mWF9zMTZsb2NIUGxEWlpxTVNPd2xwTkV3MGtQdHpzSHgxT1dOZWdFZEhSRFhLVXg3S0hTcURHZV96V3RuZVpkb09IQjdQVDVaajhEV0RpMUlWRHZDVy1fTl9Gd1l3YWFwV1JkWnV4ajlVaW8?oc=5",
     "numbers": [],
     "published": "2026-10-14T19:52:26Z",
     "source": "Insurance Business",
     "title": "Hormuz hit hands marine war underwriters another total loss as attacks surge and rhetoric escalates"
    },
    {
     "link": "https://news.google.com/rss/articles/CBMifkFVX3lxTFA1eE1IQTRrQ195RTlSSWp4cE5EY1JTbmpVY0FlOElvSW5xXzJqTjAtcWVGdE9oX1BZLWhNVVJYd3RUWV8zUVkzbTdZaGtfUmVwdXpsTXg0b3E2emlPRk11MmlTaUxHcVlZNFJMMDR0YWstLUh5Q2I5VmpPcl83Zw?oc=5",
     "numbers": [],
     "published": "2026-10-14T19:48:37Z",
     "source": "Global News",
     "title": "Oil markets ‘far’ from normal even as some Strait of Hormuz issues ease: TD"
    }
   ],
   "portwatch": {
    "baseline_year": 2025,
    "chokepoint": "Strait of Hormuz",
    "latest_date": "2026-10-11",
    "source": "IMF PortWatch, daily chokepoint transits (AIS)",
    "source_url": "https://portwatch.imf.org/",
    "tankers_7d": 0.6,
    "tankers_baseline": 48.2,
    "tankers_change_pct": -99.0
   },
   "target": "hormuz_ledger[iran_blockade].delta",
   "whiteboard": {
    "as_of": "2026-10-08",
    "source": "Max Fisher, 'The oil apocalypse is here' (YouTube, 2 Oct 2026)",
    "source_url": "https://www.youtube.com/watch?v=OETnuwwsv9U",
    "unit": "mb/d",
    "value": -20
   }
  },
  {
   "id": "gulf_exports",
   "keywords": [
    "gulf export",
    "opec export",
    "saudi export",
    "middle east export",
    "gulf crude"
   ],
   "label": "Gulf exports now",
   "mentions": [],
   "portwatch": null,
   "target": "hormuz_ledger[region_total].value",
   "whiteboard": {
    "as_of": "2026-10-08",
    "source": "Max Fisher, 'The oil apocalypse is here' (YouTube, 2 Oct 2026)",
    "source_url": "https://www.youtube.com/watch?v=OETnuwwsv9U",
    "unit": "mb/d",
    "value": 8
   }
  },
  {
   "id": "saudi_pipeline",
   "keywords": [
    "east-west pipeline",
    "yanbu",
    "aramco pipeline",
    "pumping station"
   ],
   "label": "Saudi East-West pipeline",
   "mentions": [],
   "portwatch": null,
   "target": "hormuz_ledger[saudi_eastwest].delta",
   "whiteboard": {
    "as_of": "2026-10-08",
    "source": "Max Fisher, 'The oil apocalypse is here' (YouTube, 2 Oct 2026)",
    "source_url": "https://www.youtube.com/watch?v=OETnuwwsv9U",
    "unit": "mb/d",
    "value": 5.5
   }
  },
  {
   "id": "spr",
   "keywords": [
    "strategic petroleum reserve",
    "spr release",
    "stockpile release",
    "emergency reserve",
    "emergency stock",
    "reserve release"
   ],
   "label": "Emergency stockpile releases",
   "mentions": [],
   "portwatch": null,
   "target": "hormuz_ledger[spr].delta",
   "whiteboard": {
    "as_of": "2026-10-08",
    "source": "Max Fisher, 'The oil apocalypse is here' (YouTube, 2 Oct 2026)",
    "source_url": "https://www.youtube.com/watch?v=OETnuwwsv9U",
    "unit": "mb/d",
    "value": 2.5
   }
  },
  {
   "id": "china_cuts",
   "keywords": [
    "china import",
    "chinese import",
    "china crude",
    "china's crude"
   ],
   "label": "China import cuts",
   "mentions": [],
   "portwatch": null,
   "target": "hormuz_ledger[china_cuts].delta",
   "whiteboard": {
    "as_of": "2026-10-08",
    "source": "Max Fisher, 'The oil apocalypse is here' (YouTube, 2 Oct 2026)",
    "source_url": "https://www.youtube.com/watch?v=OETnuwwsv9U",
    "unit": "mb/d",
    "value": -2.5
   }
  },
  {
   "id": "bab_el_mandeb",
   "keywords": [
    "bab al-mandab",
    "bab el-mandeb",
    "mandab",
    "mandeb",
    "red sea",
    "houthi"
   ],
   "label": "Bab al-Mandab closed",
   "mentions": [
    {
     "link": "https://news.google.com/rss/articles/CBMimgJBVV95cUxOMFdOZ21nTWo1WTNrWk9uZktpMjFwWFpQRE9DdGVTaXpVclRuR213RDF1dXpROEJaVVhEa29iWkY3eEhVc21zYVZ0UXpqRkFiM3ZvTlZNSmZWVF9IVkZuZTAwRFJCNmF5TUFsbFl2dzd1XzIwYmFiTnNjd0pEOUtnSmlRVm5hZ1UyUGpWb3RZbm0wanJTdERxZFJMZ3NTdFFTTWV1UXhUR1ZIN1B4SG96eGkyYUljZ2hmN0tOWUd5Yk9zaXBoYVp0bU4yVGZQV3h4ZHBVR3NZbEpFSHhSdTdVUG5XQTk4eld3VkRKYUdvVmZXSm5zc1A0R3FYYnVzbnJRSDFzOVJSeXBpS2tjQnc4cTMzcVpnLUpTb2c?oc=5",
     "numbers": [],
     "published": "2026-10-14T20:32:42Z",
     "source": "KTXS",
     "title": "Trump faces new Iran war challenges as Houthi attacks threaten energy supplies"
    },
    {
     "link": "https://news.google.com/rss/articles/CBMiqAFBVV95cUxQamJmQXVpQjFIQmdYc1hvcWx4ZlBvWDNBOW9vdWVQOWFFWU4zTGRTb2kxdTUzZTJBWkUzMTFxa2cxWERIeUg1dUpieDFZNUJPUFRPS1RfSll0V3R2QWxCbWF6LU00R1hDT2dMSEVMZVQzeW1jVWlYRVR0eU9kQlRRNVNYeWVOTE8xRFc4OFJ2RW4yTUk1cjVhWkxNczhUd1dDbVdUbzktU2s?oc=5",
     "numbers": [],
     "published": "2026-10-14T20:02:08Z",
     "source": "MintPress News",
     "title": "Yemen’s Resistance Thwarts Greater Israel Plot for Red Sea Dominance"
    },
    {
     "link": "https://news.google.com/rss/articles/CBMiiwFBVV95cUxNWklxdmV2ZWp5QVhSOF8wMzZSZ2VxbWswYlMxRkVHVkdJa1RMTVF0Mk5QSEFyRUtLdmMxNEdSMHdfdkZBdlJmUi14b2F5Ykluc2xSQVNIdjdsN0VzVTBvcGRYdjQtc0EyTTNvNGxORTRjOWw1dVE5VVlXM1FkenQ3b0U0ODVrNEkySi1R?oc=5",
     "numbers": [],
     "published": "2026-10-14T18:15:02Z",
     "source": "Al Majalla",
     "title": "Is it time for China to rethink its Houthi policy?"
    }
   ],
   "portwatch": {
    "baseline_year": 2025,
    "chokepoint": "Bab el-Mandeb",
    "latest_date": "2026-10-11",
    "source": "IMF PortWatch, daily chokepoint transits (AIS)",
    "source_url": "https://portwatch.imf.org/",
    "tankers_7d": 8.6,
    "tankers_baseline": 11.5,
    "tankers_change_pct": -25.0
   },
   "target": "shipping.route_note",
   "whiteboard": {
    "as_of": "2026-10-08",
    "source": "Max Fisher, 'The oil apocalypse is here' (YouTube, 2 Oct 2026)",
    "source_url": "https://www.youtube.com/watch?v=OETnuwwsv9U",
    "unit": "",
    "value": "Houthis took Yemen coast in Sept and closed Bab al-Mandab; Asia-bound oil goes Suez → Med → Cape of Good Hope"
   }
  },
  {
   "id": "voyage",
   "keywords": [
    "cape of good hope",
    "around africa",
    "reroute",
    "rerouting",
    "longer voyage"
   ],
   "label": "Voyage Gulf–Asia, days",
   "mentions": [],
   "portwatch": {
    "baseline_year": 2025,
    "chokepoint": "Cape of Good Hope",
    "latest_date": "2026-10-11",
    "source": "IMF PortWatch, daily chokepoint transits (AIS)",
    "source_url": "https://portwatch.imf.org/",
    "tankers_7d": 17.4,
    "tankers_baseline": 16.9,
    "tankers_change_pct": 3.0
   },
   "target": "shipping.voyage_days_now",
   "whiteboard": {
    "as_of": "2026-10-08",
    "source": "Max Fisher, 'The oil apocalypse is here' (YouTube, 2 Oct 2026)",
    "source_url": "https://www.youtube.com/watch?v=OETnuwwsv9U",
    "unit": "days",
    "value": 48
   }
  },
  {
   "id": "vlcc",
   "keywords": [
    "vlcc",
    "supertanker",
    "tanker rate",
    "freight rate",
    "day rate"
   ],
   "label": "VLCC day rate",
   "mentions": [],
   "portwatch": null,
   "target": "shipping.vlcc_day_rate_usd.now",
   "whiteboard": {
    "as_of": "2026-10-08",
    "source": "Max Fisher, 'The oil apocalypse is here' (YouTube, 2 Oct 2026)",
    "source_url": "https://www.youtube.com/watch?v=OETnuwwsv9U",
    "unit": "USD/day",
    "value": 1200000
   }
  },
  {
   "id": "refineries_russia",
   "keywords": [
    "russian refiner",
    "refinery strike",
    "refinery drone",
    "refineries",
    "ukrainian drone"
   ],
   "label": "Russian refineries struck",
   "mentions": [
    {
     "link": "https://news.google.com/rss/articles/CBMisgFBVV95cUxNZHJ0ZWxPWU9HUUNOYU5fZS1jVnAyd2R0MENsa3hNRTlldGJGT1FZSF9VaUtENXlYbEMyVWZTSGRwZzh3WldWNTJoM2pNR2JxN0F4VXZYcDE0N01WZUo3d0JXQlJrdlRCREtuV19hWTJXSXhTVUMwUjZpVVVIWGxHaHdmeU5kMDQtVkdBUzNNRE5jNWh1c08yT00zTE1BRXRraG5vaDl1bWxhdkh2dVNtRTd3?oc=5",
     "numbers": [],
     "published": "2026-10-14T19:55:55Z",
     "source": "Around Prague",
     "title": "Russia accuses Ukraine of attacking two refineries, Kyiv denies it"
    }
   ],
   "portwatch": null,
   "target": "refinery_shock[0].diesel_delta_mbd",
   "whiteboard": {
    "as_of": "2026-10-08",
    "source": "Max Fisher, 'The oil apocalypse is here' (YouTube, 2 Oct 2026)",
    "source_url": "https://www.youtube.com/watch?v=OETnuwwsv9U",
    "unit": "mb/d",
    "value": -1.0
   }
  },
  {
   "id": "china_diesel",
   "keywords": [
    "diesel export",
    "china diesel",
    "chinese diesel"
   ],
   "label": "China diesel exports",
   "mentions": [],
   "portwatch": null,
   "target": "refinery_shock[2].diesel_delta_mbd",
   "whiteboard": {
    "as_of": "2026-10-08",
    "source": "Max Fisher, 'The oil apocalypse is here' (YouTube, 2 Oct 2026)",
    "source_url": "https://www.youtube.com/watch?v=OETnuwwsv9U",
    "unit": "mb/d",
    "value": -0.5
   }
  }
 ],
 "fetched_at": "2026-10-14T20:41:19Z",
 "generated_at": "2026-10-14T20:41:19Z",
 "news_items_scanned": 60,
 "schema_version": 1,
 "source": "Crackspread cross-check of manual.json against news.json and shipping.json",
 "source_url": "https://github.com/fixoa/crackspread",
 "stale": false
}
